{
  "scenario_name": "orlando_real_world_demo",
  "map_context": {
    "mode": "real_world_demo",
    "center": [-81.3792, 28.5383],
    "zoom": 10
  },
  "metadata": {
    "source": "OpenStreetMap via Overpass API",
    "osm_relation": 1128379,
    "osm_wikidata": "Q49233"
  },
  "objects": [
    {
      "type": "label",
      "name": "Downtown Orlando",
      "placement": {
        "mode": "point",
        "coordinate": [-81.3792, 28.5383]
      },
      "properties": {
        "anchor_role": "demo_center"
      },
      "style": {
        "marker_color": "#111827",
        "text_color": "#111827"
      }
    },
    {
      "type": "objective_marker",
      "name": "Orlando International Airport",
      "placement": {
        "mode": "point",
        "coordinate": [-81.3089, 28.4312]
      },
      "properties": {
        "anchor_role": "airport_reference"
      }
    }
  ],
  "layers": [
    {
      "type": "region_boundary",
      "name": "Orlando City Boundary",
      "operation": "overpass_query",
      "pipeline": "real_world",
      "parameters": {
        "query": "[out:json][timeout:90];rel[\"boundary\"=\"administrative\"][\"admin_level\"=\"8\"][\"wikidata\"=\"Q49233\"];out geom;"
      },
      "style": {
        "stroke_color": "#111827",
        "stroke_width": 3,
        "fill_opacity": 0
      }
    },
    {
      "type": "perimeter",
      "name": "Downtown 5 km Area",
      "operation": "buffer",
      "parameters": {
        "center": [-81.3792, 28.5383],
        "radius_km": 5,
        "steps": 64
      },
      "style": {
        "fill_color": "#2563eb",
        "fill_opacity": 0.12,
        "stroke_color": "#1d4ed8"
      }
    },
    {
      "type": "range_ring",
      "name": "Downtown 10 km Ring",
      "operation": "range_ring",
      "parameters": {
        "center": [-81.3792, 28.5383],
        "radius_km": 10,
        "steps": 96
      }
    },
    {
      "type": "corridor",
      "name": "Downtown to Airport Corridor",
      "operation": "corridor",
      "parameters": {
        "coordinates": [
          [-81.3792, 28.5383],
          [-81.357, 28.503],
          [-81.331, 28.468],
          [-81.3089, 28.4312]
        ],
        "width_m": 1200
      },
      "style": {
        "fill_color": "#0ea5e9",
        "fill_opacity": 0.18,
        "stroke_color": "#0369a1"
      }
    }
  ]
}
